{"desired_plan":{"hard_dependencies":[{"from":{"plan_key":"phase-control-live-gantt","project_id":"lattice","task_id":"lpg-001"},"to":{"plan_key":"phase-control-live-gantt","project_id":"lattice","task_id":"lpg-002"}},{"from":{"plan_key":"phase-control-live-gantt","project_id":"lattice","task_id":"lpg-002"},"to":{"plan_key":"phase-control-live-gantt","project_id":"lattice","task_id":"lpg-003"}},{"from":{"plan_key":"phase-control-live-gantt","project_id":"lattice","task_id":"lpg-003"},"to":{"plan_key":"phase-control-live-gantt","project_id":"lattice","task_id":"lpg-004"}},{"from":{"plan_key":"phase-control-live-gantt","project_id":"lattice","task_id":"lpg-003"},"to":{"plan_key":"phase-control-live-gantt","project_id":"lattice","task_id":"lpg-005"}},{"from":{"plan_key":"phase-control-live-gantt","project_id":"lattice","task_id":"lpg-004"},"to":{"plan_key":"phase-control-live-gantt","project_id":"lattice","task_id":"lpg-006"}},{"from":{"plan_key":"phase-control-live-gantt","project_id":"lattice","task_id":"lpg-005"},"to":{"plan_key":"phase-control-live-gantt","project_id":"lattice","task_id":"lpg-006"}},{"from":{"plan_key":"phase-control-live-gantt","project_id":"lattice","task_id":"lpg-006"},"to":{"plan_key":"phase-control-live-gantt","project_id":"lattice","task_id":"lpg-007"}},{"from":{"plan_key":"phase-control-live-gantt","project_id":"lattice","task_id":"lpg-006"},"to":{"plan_key":"phase-control-live-gantt","project_id":"lattice","task_id":"lpg-008"}},{"from":{"plan_key":"phase-control-live-gantt","project_id":"lattice","task_id":"lpg-007"},"to":{"plan_key":"phase-control-live-gantt","project_id":"lattice","task_id":"lpg-009"}},{"from":{"plan_key":"phase-control-live-gantt","project_id":"lattice","task_id":"lpg-008"},"to":{"plan_key":"phase-control-live-gantt","project_id":"lattice","task_id":"lpg-009"}},{"from":{"plan_key":"phase-control-live-gantt","project_id":"lattice","task_id":"lpg-009"},"to":{"plan_key":"phase-control-live-gantt","project_id":"lattice","task_id":"lpg-010"}},{"from":{"plan_key":"phase-control-live-gantt","project_id":"lattice","task_id":"lpg-010"},"to":{"plan_key":"phase-control-live-gantt","project_id":"lattice","task_id":"lpg-011"}},{"from":{"plan_key":"phase-control-live-gantt","project_id":"lattice","task_id":"lpg-011"},"to":{"plan_key":"phase-control-live-gantt","project_id":"lattice","task_id":"lpg-012"}},{"from":{"plan_key":"phase-control-live-gantt","project_id":"lattice","task_id":"lpg-012"},"to":{"plan_key":"phase-control-live-gantt","project_id":"lattice","task_id":"lpg-013"}},{"from":{"plan_key":"phase-control-live-gantt","project_id":"lattice","task_id":"lpg-013"},"to":{"plan_key":"phase-control-live-gantt","project_id":"lattice","task_id":"lpg-014"}},{"from":{"plan_key":"phase-control-live-gantt","project_id":"lattice","task_id":"lpg-015"},"to":{"plan_key":"phase-control-live-gantt","project_id":"lattice","task_id":"lpg-016"}},{"from":{"plan_key":"phase-control-live-gantt","project_id":"lattice","task_id":"lpg-016"},"to":{"plan_key":"phase-control-live-gantt","project_id":"lattice","task_id":"lpg-017"}},{"from":{"plan_key":"phase-control-live-gantt","project_id":"lattice","task_id":"lpg-017"},"to":{"plan_key":"phase-control-live-gantt","project_id":"lattice","task_id":"lpg-018"}},{"from":{"plan_key":"phase-control-live-gantt","project_id":"lattice","task_id":"lpg-018"},"to":{"plan_key":"phase-control-live-gantt","project_id":"lattice","task_id":"lpg-019"}},{"from":{"plan_key":"phase-control-live-gantt","project_id":"lattice","task_id":"lpg-020"},"to":{"plan_key":"phase-control-live-gantt","project_id":"lattice","task_id":"lpg-021"}},{"from":{"plan_key":"phase-control-live-gantt","project_id":"lattice","task_id":"lpg-020"},"to":{"plan_key":"phase-control-live-gantt","project_id":"lattice","task_id":"lpg-022"}},{"from":{"plan_key":"phase-control-live-gantt","project_id":"lattice","task_id":"lpg-021"},"to":{"plan_key":"phase-control-live-gantt","project_id":"lattice","task_id":"lpg-023"}},{"from":{"plan_key":"phase-control-live-gantt","project_id":"lattice","task_id":"lpg-022"},"to":{"plan_key":"phase-control-live-gantt","project_id":"lattice","task_id":"lpg-023"}},{"from":{"plan_key":"phase-control-live-gantt","project_id":"lattice","task_id":"lpg-023"},"to":{"plan_key":"phase-control-live-gantt","project_id":"lattice","task_id":"lpg-024"}},{"from":{"plan_key":"phase-control-live-gantt","project_id":"lattice","task_id":"lpg-025"},"to":{"plan_key":"phase-control-live-gantt","project_id":"lattice","task_id":"lpg-026"}},{"from":{"plan_key":"phase-control-live-gantt","project_id":"lattice","task_id":"lpg-025"},"to":{"plan_key":"phase-control-live-gantt","project_id":"lattice","task_id":"lpg-027"}},{"from":{"plan_key":"phase-control-live-gantt","project_id":"lattice","task_id":"lpg-026"},"to":{"plan_key":"phase-control-live-gantt","project_id":"lattice","task_id":"lpg-028"}},{"from":{"plan_key":"phase-control-live-gantt","project_id":"lattice","task_id":"lpg-027"},"to":{"plan_key":"phase-control-live-gantt","project_id":"lattice","task_id":"lpg-028"}},{"from":{"plan_key":"phase-control-live-gantt","project_id":"lattice","task_id":"lpg-028"},"to":{"plan_key":"phase-control-live-gantt","project_id":"lattice","task_id":"lpg-029"}},{"from":{"plan_key":"phase-control-live-gantt","project_id":"lattice","task_id":"lpg-029"},"to":{"plan_key":"phase-control-live-gantt","project_id":"lattice","task_id":"lpg-030"}},{"from":{"plan_key":"phase-control-live-gantt","project_id":"lattice","task_id":"lpg-029"},"to":{"plan_key":"phase-control-live-gantt","project_id":"lattice","task_id":"lpg-032"}},{"from":{"plan_key":"phase-control-live-gantt","project_id":"lattice","task_id":"lpg-029"},"to":{"plan_key":"phase-control-live-gantt","project_id":"lattice","task_id":"lpg-033"}},{"from":{"plan_key":"phase-control-live-gantt","project_id":"lattice","task_id":"lpg-030"},"to":{"plan_key":"phase-control-live-gantt","project_id":"lattice","task_id":"lpg-031"}},{"from":{"plan_key":"phase-control-live-gantt","project_id":"lattice","task_id":"lpg-032"},"to":{"plan_key":"phase-control-live-gantt","project_id":"lattice","task_id":"lpg-035"}},{"from":{"plan_key":"phase-control-live-gantt","project_id":"lattice","task_id":"lpg-033"},"to":{"plan_key":"phase-control-live-gantt","project_id":"lattice","task_id":"lpg-034"}},{"from":{"plan_key":"phase-control-live-gantt","project_id":"lattice","task_id":"lpg-034"},"to":{"plan_key":"phase-control-live-gantt","project_id":"lattice","task_id":"lpg-035"}},{"from":{"plan_key":"phase-control-live-gantt","project_id":"lattice","task_id":"lpg-035"},"to":{"plan_key":"phase-control-live-gantt","project_id":"lattice","task_id":"lpg-030"}}],"joins":[],"phase_accept_dependencies":[],"phases":[{"gate_policy":"dotagents-heavy","phase_id":"lattice-codegraph-removal","predecessor_phase_ids":[],"required_evidence_slots":["adversarial-review","fresh-dogfood","full-gate"],"title":"Lattice hardeningと実運用統制"}],"plan_digest":"37bc1e80780e9e48774609c61d01a2cf8c695e9e808d460e11c22ee6818b562e","plan_key":"phase-control-live-gantt","plan_version":"rev-aaf251c169b577e1b85dbf35","predecessor_plan_digest":"0b2d3eedc110dd6f44e40540f17b84df97c380d6b13a2249e147864f0e1046da","project_id":"lattice","schema":"lattice.todo_plan.v5","tasks":[{"compile_binding":null,"lane":"phase-0","narrative_anchor":null,"narrative_ref":"docs/archive/phase-hardening-authoring-cutover.md#L6","parent_task_id":null,"phase_id":"lattice-codegraph-removal","task_id":"lpg-001","title":"計画を敵対的検証し裁定を正本へ反映する"},{"compile_binding":null,"lane":"phase-1","narrative_anchor":null,"narrative_ref":"docs/archive/phase-hardening-authoring-cutover.md#L12","parent_task_id":null,"phase_id":"lattice-codegraph-removal","task_id":"lpg-002","title":"cross-plan・Gantt freshness・CLI互換のcharacterizationを置く"},{"compile_binding":null,"lane":"phase-1","narrative_anchor":null,"narrative_ref":"docs/archive/phase-hardening-authoring-cutover.md#L13","parent_task_id":null,"phase_id":"lattice-codegraph-removal","task_id":"lpg-003","title":"既存公開契約の不整合と旧運用入口を修正する"},{"compile_binding":null,"lane":"phase-2","narrative_anchor":null,"narrative_ref":"docs/archive/phase-hardening-authoring-cutover.md#L14","parent_task_id":null,"phase_id":"lattice-codegraph-removal","task_id":"lpg-004","title":"first-class Phase schemaと線形journal安全網を実装する"},{"compile_binding":null,"lane":"phase-3","narrative_anchor":null,"narrative_ref":"docs/archive/phase-hardening-authoring-cutover.md#L15","parent_task_id":null,"phase_id":"lattice-codegraph-removal","task_id":"lpg-005","title":"stable readとlive Gantt安全網を実装する"},{"compile_binding":null,"lane":"phase-2","narrative_anchor":null,"narrative_ref":"docs/archive/phase-hardening-authoring-cutover.md#L16","parent_task_id":null,"phase_id":"lattice-codegraph-removal","task_id":"lpg-006","title":"Phase transition・status・revision・migrationを実装する"},{"compile_binding":null,"lane":"phase-3","narrative_anchor":null,"narrative_ref":"docs/archive/phase-hardening-authoring-cutover.md#L17","parent_task_id":null,"phase_id":"lattice-codegraph-removal","task_id":"lpg-007","title":"Phase projectionとforeground live viewerを実装する"},{"compile_binding":null,"lane":"phase-5","narrative_anchor":null,"narrative_ref":"docs/archive/phase-hardening-authoring-cutover.md#L18","parent_task_id":null,"phase_id":"lattice-codegraph-removal","task_id":"lpg-008","title":"bounded seam candidateと隔離transformを一般化する"},{"compile_binding":null,"lane":"phase-4","narrative_anchor":null,"narrative_ref":"docs/archive/phase-hardening-authoring-cutover.md#L19","parent_task_id":null,"phase_id":"lattice-codegraph-removal","task_id":"lpg-009","title":"AIShell planを明示Phase付きsuccessor revisionへ移行する"},{"compile_binding":null,"lane":"phase-6","narrative_anchor":null,"narrative_ref":"docs/archive/phase-hardening-authoring-cutover.md#L7","parent_task_id":null,"phase_id":"lattice-codegraph-removal","task_id":"lpg-010","title":"関連integrationと実browser受入を行う"},{"compile_binding":null,"lane":"phase-6","narrativ